0.0,l'atac anava adreçat a la població més vulnerable,l'atac anava adreçat a la població més vulnerable
0.2727272727272727,la tracció per eruga és complexa cara i pateix molt desgast,l'atracció per eruga és complexa cara i patís molt desgast
0.14285714285714285,aquesta cançó es pot tocar mentre apareixen els crèdits encara que no és necessari,aquesta cançó es pot tocar mentre aparèixer en els crèdits encara que no és necessari
0.0,diversos altres objectes petits s'han trobat en òrbites similars,diversos altres objectes petits s'han trobat en òrbites similars
0.07692307692307693,té una alçada de dues plantes i està exempt pràcticament de tota ornamentació,té una alçada de dues plantes i està absent pràcticament de tota ornamentació
0.14285714285714285,aviat guanyaria el premi especial de graduació,aviat guanyaria el premi especial de rodoció
0.0,és una ciutat bastant pròspera,és una ciutat bastant pròspera
0.0,va aixecar un exèrcit contra ells i va ser derrotat,va aixecar un exèrcit contra ells i va ser derrotat
0.0,en tots tres casos el seu equip va perdre la categoria,en tots tres casos el seu equip va perdre la categoria
0.0,també la persona perjudicada pot ser física o jurídica,també la persona perjudicada pot ser física o jurídica
0.5,paul respectivament,pal respectivament
0.0,aquesta obra el va fer molt popular en un públic estudiant molt ampli,aquesta obra el va fer molt popular en un públic estudiant molt ampli
0.0,hi ha nombroses receptes arreu dels països catalans totes molt apreciades,hi ha nombroses receptes arreu dels països catalans totes molt apreciades
0.2,aconseguí obrir fins a cinc filials repartides entre quart de poblet torrent gandia i vilamarxant,aconseguí obrir fins a cinc filiades repartides entre quart de poblet torrent gardia i vilamanxant
0.09090909090909091,fins i tot avui en dia s'utilitza de llibre de referència,fins i tot avui en dia s'utilitza el llibre de referència
0.07142857142857142,hi ha un sistema multipartidista encara que amb poques diferències en les seves organitzacions,hi ha un sistema multipartidista encara que amb poques diferències en les seues organitzacions
0.0,així a la planta baixa es localitza el registre la biblioteca i la sala d'actes,així a la planta baixa es localitza el registre la biblioteca i la sala d'actes
0.0,aquest ambient repressiu va dur alguns a escollir l'exili a parís,aquest ambient repressiu va dur alguns a escollir l'exili a parís
0.4,tornant a casa dos amics decideixen parar en un bar,tornan a casa dos amics decidixen pararen un bar
0.0,i així gairebé tots els pobles tingueren el seu,i així gairebé tots els pobles tingueren el seu
0.0,probablement era un principat mede,probablement era un principat mede
0.14285714285714285,la desescolarització de la societat implica el reconeixement de la naturalesa ambivalent de l'aprenentatge,la desescolarització de la societat implica el reconeixement de la naturalesa amb ivalent de l'aprenentatge
0.1,el seu màxim representant era el mateix joan verger pocoví,el seu màxim representant era el mateix joan verger pocuví
0.0,va establir el ritual per a la dedicació dels temples,va establir el ritual per a la dedicació dels temples
0.07692307692307693,durant el seu mandat fou un dels elaboradors de la llei dels ajuntaments,durant el seu mandat fou un dels el·laboradors de la llei dels ajuntaments
0.0,llicenciat en dret va optar per la carrera militar,llicenciat en dret va optar per la carrera militar
0.0,garantia real que podrà ser executada en cas d'incomplir-se el contracte subscrit per l'urbanitzador,garantia real que podrà ser executada en cas d'incomplir-se el contracte subscrit per l'urbanitzador
0.0,els visitants són registrats i les borses i cistelles són revisades a la recerca d'explosius,els visitants són registrats i les borses i cistelles són revisades a la recerca d'explosius
0.125,la seva intimitat amb racine data de llavors,la seva intimitat amb recint data de llavors
0.07142857142857142,era lloc de residència de masovers i no pas dels propietaris la família pons,era lloc de residència de masovers i no pas els propietaris la família pons
0.0,la neu i les gelades són excepcionals a la plana,la neu i les gelades són excepcionals a la plana
0.0,no és afectat per gaires malalties i plagues,no és afectat per gaires malalties i plagues
0.0,la pell és prima densa i suau sense pèls llargs,la pell és prima densa i suau sense pèls llargs
0.0,en l'actualitat només és utilitzat per a demostracions docents dels principis del pèndol,en l'actualitat només és utilitzat per a demostracions docents dels principis del pèndol
0.0,la zona es compon de grans deserts àrids principalment el sàhara,la zona es compon de grans deserts àrids principalment el sàhara
0.13333333333333333,exemples de possibles canals de retorn serien les línies telefòniques fixes o la telefonia mòbil,exemples de possibles canals de retorn serien les línies telefòniques fixes a la celefònia mòbil
0.06666666666666667,va tornar de londres per estudiar relacions internacionals i protocol per l'escola internacional de protocol,va tornar de londres per estudiar relacions internacionals i protocols per l'escola internacional de protocol
0.0,el revers de la fulla és lluent,el revers de la fulla és lluent
0.0,les seves obligacions conciliars no li impedeixen seguir amb les seves activitats intel·lectuals,les seves obligacions conciliars no li impedeixen seguir amb les seves activitats intel·lectuals
0.1,el disseny guanyador ret homenatge als llenyataires de la ciutat,el disseny guanyador ret homenatja als llenyataires de la ciutat
0.0,també fou un musicògraf distingit,també fou un musicògraf distingit
0.2,això pot afavorir la sinusitis que provoquen mal de cap malestar i de vegades irritabilitat,això pot afavorir las inucitis que provoquen molt de cap malestar i de vegades irritabilitat
0.0,es considera un punt crític de la biodiversitat mundial,es considera un punt crític de la biodiversitat mundial
0.13333333333333333,els russos amenaçaven en conquerir teheran en cinc dies si pèrsia no acceptava les condicions,els russos amenaçaven en conquerir-te eran en cinc dies si pèrsia no acceptava les condicions
0.0,el cofret contenia el fetge o la melsa de la reina momificat,el cofret contenia el fetge o la melsa de la reina momificat
0.08333333333333333,els cognoms occitans que apareixen en els documents sacramentals així ho demostren,els cognoms occitans que apareixen en els documents acramentals així ho demostren
0.0,es forma a l'extrem de llevant de la serreta des d'on davalla cap al sud-est,es forma a l'extrem de llevant de la serreta des d'on davalla cap al sud-est
0.0,el clima era molt fred però sa,el clima era molt fred però sa
0.0,com a instrument solista s'usa rarament,com a instrument solista s'usa rarament
0.0,la façana s'estructura en tres pisos,la façana s'estructura en tres pisos
0.0,l'únic punt a tractar era l'amenaça francesa al rosselló,l'únic punt a tractar era l'amenaça francesa al rosselló
0.1111111111111111,la marioneta és misteriosament animada per màgia i s'escapoleix,la marioneta és misteriosament animada per matja i s'escapoleix
0.15384615384615385,la resta de diputats va intentar fer-los callar amb aplaudiments cap al monarca,la resta de diputats vointentar fer-los callar amb aplaudiments cap al monarca
0.07692307692307693,la seva influència va ser decisiva per la construcció del circuit de catalunya,la seva influència va ser decisiva per a la construcció del circuit de catalunya
0.06666666666666667,es tracta d'un torrent de règim mediterrani que només porta aigua els dies de pluja,es tracta d'un torrent de règim mediterrani que només porta aigua als dies de pluja
0.0,l'edifici té quatre plantes,l'edifici té quatre plantes
0.0,posteriorment tornaria a l'argentina,posteriorment tornaria a l'argentina
0.1111111111111111,també existeix una versió del mètode per a nens,també existix una versió del mètode per a nens
0.0,les temperatures són baixes en hivern són freqüents les gelades nocturnes i les neus,les temperatures són baixes en hivern són freqüents les gelades nocturnes i les neus
0.0,també habita les balears,també habita les balears
0.0,les seves filles es van casar dins la noblesa russa,les seves filles es van casar dins la noblesa russa
0.0,només un petit llogaret es resisteix a sotmetre's a la dominació de l'imperi romà,només un petit llogaret es resisteix a sotmetre's a la dominació de l'imperi romà
0.0,el seu estil és innovador abandonant la polifonia i apropant-se més a la tonalitat,el seu estil és innovador abandonant la polifonia i apropant-se més a la tonalitat
0.25,un cràter a mart porta el seu nom,un cràter amart porta el seu nom
0.0,la resta de l'edifici és molt precari,la resta de l'edifici és molt precari
0.08333333333333333,aquesta s'entén com a l'efecte nociu que certes substàncies exerceixen a l'oïda,aquesta s'entén com a l'efecte nociu que certes substàncies exercixen a l'oïda
0.0,també és multiplataforma,també és multiplataforma
0.0,els cursos d'aigua sovint concentren palletes d'or i partícules d'or més primes,els cursos d'aigua sovint concentren palletes d'or i partícules d'or més primes
0.0,és un edifici situat al centre de la ciutat,és un edifici situat al centre de la ciutat
0.0,molts membres de la banda santa rosa no viuen a la reserva,molts membres de la banda santa rosa no viuen a la reserva
0.0,fan un al·legat de la individualitat i de la determinació com a motor del món,fan un al·legat de la individualitat i de la determinació com a motor del món
0.0,hi havia també un guanyador individual com en qualsevol cursa de motocròs,hi havia també un guanyador individual com en qualsevol cursa de motocròs
0.06666666666666667,comunica per davant amb l'esòfag que s'obre en el sac dorsal i amb el reticle,comunica per davant amb l'isòfag que s'obre en el sac dorsal i amb el reticle
0.13333333333333333,tot el conjunt està tancat per un corral o barri on hi ha diverses construccions,tot el conjunt està tancat per un corral obarri on hi ha diverses construccions
0.07692307692307693,durant aquest període fou quan es va incorporar la regió de frísia occidental,durant aquest període fou quan es va incorporar la regió de frícia occidental
0.0,pot arribar a provocar la mort,pot arribar a provocar la mort
0.0,l'ala nord correspon al senat i l'ala sud a la cambra de representants,l'ala nord correspon al senat i l'ala sud a la cambra de representants
0.0,consta de vuit números,consta de vuit números
0.26666666666666666,aquest corrent és causat per la intensificació del corrent circumpolar antàrtic mentre arrodoneix el cap,aquest corrent és causat per la intensificació del corrent circumpolant antàrticment que arrodoneix el camp
0.0,el conjunt presenta un aspecte compacte,el conjunt presenta un aspecte compacte
0.18181818181818182,la intensitat de la reacció indica la gravetat de la inflamació,la intensitat de la reacció commita la gravitat de la inflamació
0.06666666666666667,colet és guia del castellet de perpinyà i agent del patrimoni de l'ajuntament d'aquesta ciutat,colet es guia del castellet de perpinyà i agent del patrimoni de l'ajuntament d'aquesta ciutat
0.0,no són recursos disponibles a tots els hospitals i centres sanitaris,no són recursos disponibles a tots els hospitals i centres sanitaris
0.0,moltes instal·lacions esportives i concerts ofereixen entrades electròniques per als seus esdeveniments,moltes instal·lacions esportives i concerts ofereixen entrades electròniques per als seus esdeveniments
0.0,hi ha també diverses inscripcions menors en diferents punts de l'església,hi ha també diverses inscripcions menors en diferents punts de l'església
0.1,l'emblema de la legió era un centaure i un bou,l'emblema de la legió era a un centaure i un bou
0.0,no obstant això els fiscals van declinar presentar càrrecs per homicidi,no obstant això els fiscals van declinar presentar càrrecs per homicidi
0.0,deixà nombroses publicacions en forma d'articles i de llibres bastants destinats als estudiants,deixà nombroses publicacions en forma d'articles i de llibres bastants destinats als estudiants
0.18181818181818182,té diversos cossos uns de tres plantes i altres de dues,té diversos cossos uns de tres plantes i altres dendues
0.0,hi trobem les serres de cadí i moixeró el puig d'alp i puigllançada,hi trobem les serres de cadí i moixeró el puig d'alp i puigllançada
0.0,es pot aconseguir dotant als ciutadans d'una xarxa de recursos per a facilitar-los que s'apoderen,es pot aconseguir dotant als ciutadans d'una xarxa de recursos per a facilitar-los que s'apoderen
0.0,tenen hemolimfa tots els artròpodes la majoria dels mol·luscs amb un sistema circulatori obert,tenen hemolimfa tots els artròpodes la majoria dels mol·luscs amb un sistema circulatori obert
0.0,ni la música ni el llibret d'aquesta obra han sobreviscut,ni la música ni el llibret d'aquesta obra han sobreviscut
0.0,va estudiar arquitectura a la universitat iberoamericana,va estudiar arquitectura a la universitat iberoamericana
0.0,encara que les ruïnes no estan molt ben conservades la seva història és important,encara que les ruïnes no estan molt ben conservades la seva història és important
0.06666666666666667,dins l'àmbit català és més coneguda com a escriptora o crítica de literatura infantil il·lustrada,dins l'àmbit català és més coneguda com a escriptora o crítica de literatura infantil i il·lustrada
0.0,la cresta està envoltada per diversos llacs petits,la cresta està envoltada per diversos llacs petits
0.1,la inscripció obligatòria i la segregació dels jueus s'estengué ràpidament,la inscripció obligatòria i la segregació des jueus s'estengué ràpidament
0.0,aquest formatge s'elabora amb llet de vaca a la primavera quan té més gust,aquest formatge s'elabora amb llet de vaca a la primavera quan té més gust
0.0,tot un conjunt de finestres i portes gòtiques s'obren cap a l'exterior,tot un conjunt de finestres i portes gòtiques s'obren cap a l'exterior
0.0,es poden classificar segons la cobertura en nacional internacional o regional,es poden classificar segons la cobertura en nacional internacional o regional
TOTAL,0.053010,0.013747,,