wav_filename,wav_filesize,transcript
common_voice_ca_20560281.wav,157484,molts membres de la banda santa rosa no viuen a la reserva
common_voice_ca_20200856.wav,238124,fan un al·legat de la individualitat i de la determinació com a motor del món
common_voice_ca_21226599.wav,216620,hi havia també un guanyador individual com en qualsevol cursa de motocròs
common_voice_ca_20560282.wav,228908,comunica per davant amb l'esòfag que s'obre en el sac dorsal i amb el reticle
common_voice_ca_21226557.wav,217388,tot el conjunt està tancat per un corral o barri on hi ha diverses construccions
common_voice_ca_20515485.wav,223532,durant aquest període fou quan es va incorporar la regió de frísia occidental
common_voice_ca_21285970.wav,135212,pot arribar a provocar la mort
common_voice_ca_20506747.wav,248108,l'ala nord correspon al senat i l'ala sud a la cambra de representants
common_voice_ca_20581271.wav,114476,consta de vuit números
common_voice_ca_21851069.wav,238124,aquest corrent és causat per la intensificació del corrent circumpolar antàrtic mentre arrodoneix el cap
common_voice_ca_23589784.wav,122924,el conjunt presenta un aspecte compacte
common_voice_ca_20942568.wav,149804,la intensitat de la reacció indica la gravetat de la inflamació
common_voice_ca_21333550.wav,249644,colet és guia del castellet de perpinyà i agent del patrimoni de l'ajuntament d'aquesta ciutat
common_voice_ca_20574185.wav,218924,no són recursos disponibles a tots els hospitals i centres sanitaris
common_voice_ca_20902842.wav,332588,moltes instal·lacions esportives i concerts ofereixen entrades electròniques per als seus esdeveniments
common_voice_ca_21079033.wav,195884,hi ha també diverses inscripcions menors en diferents punts de l'església
common_voice_ca_20581269.wav,180524,l'emblema de la legió era un centaure i un bou
common_voice_ca_21852463.wav,257324,no obstant això els fiscals van declinar presentar càrrecs per homicidi
common_voice_ca_21872316.wav,305708,deixà nombroses publicacions en forma d'articles i de llibres bastants destinats als estudiants
common_voice_ca_20843479.wav,232748,té diversos cossos uns de tres plantes i altres de dues
common_voice_ca_20506748.wav,255788,hi trobem les serres de cadí i moixeró el puig d'alp i puigllançada
common_voice_ca_20567474.wav,225068,es pot aconseguir dotant als ciutadans d'una xarxa de recursos per a facilitar-los que s'apoderen
common_voice_ca_19911337.wav,298028,tenen hemolimfa tots els artròpodes la majoria dels mol·luscs amb un sistema circulatori obert
common_voice_ca_20572961.wav,190508,ni la música ni el llibret d'aquesta obra han sobreviscut
common_voice_ca_21333552.wav,161324,va estudiar arquitectura a la universitat iberoamericana
common_voice_ca_20200862.wav,218924,encara que les ruïnes no estan molt ben conservades la seva història és important
common_voice_ca_20567473.wav,249644,dins l'àmbit català és més coneguda com a escriptora o crítica de literatura infantil il·lustrada
common_voice_ca_21255267.wav,217388,la cresta està envoltada per diversos llacs petits
common_voice_ca_20561099.wav,194348,la inscripció obligatòria i la segregació dels jueus s'estengué ràpidament
common_voice_ca_19904797.wav,246572,aquest formatge s'elabora amb llet de vaca a la primavera quan té més gust
common_voice_ca_20567411.wav,199724,tot un conjunt de finestres i portes gòtiques s'obren cap a l'exterior
common_voice_ca_19896655.wav,198188,es poden classificar segons la cobertura en nacional internacional o regional
